{
  "schema_version": "1.0",
  "frame_id": "nuscenes_sample_000001",
  "source": "nuscenes",
  "camera_name": "CAM_FRONT",
  "scene": {
    "summary": "An urban road with a red car moving ahead in the ego lane and a pedestrian waiting near the right roadside.",
    "road_type": "urban",
    "is_intersection": false,
    "weather": "clear",
    "visibility": "good",
    "traffic_light_state": "not_visible",
    "left_lane_marking": "dashed",
    "right_lane_marking": "solid"
  },
  "objects": [
    {
      "object_id": "vlm_obj_001",
      "category": "vehicle",
      "subtype": "car",
      "color": "red",
      "bbox_2d": [0.42, 0.39, 0.58, 0.67],
      "relative_position": "front",
      "lane_relation": "ego_lane",
      "motion_state": "moving_same_direction",
      "distance_level": "medium",
      "occlusion": "none",
      "confidence": 0.91
    },
    {
      "object_id": "vlm_obj_002",
      "category": "pedestrian",
      "subtype": "adult",
      "color": "unknown",
      "bbox_2d": [0.76, 0.35, 0.81, 0.62],
      "relative_position": "front_right",
      "lane_relation": "roadside",
      "motion_state": "stopped",
      "distance_level": "medium",
      "occlusion": "partial",
      "confidence": 0.78
    }
  ],
  "potential_hazards": [
    {
      "hazard_id": "hazard_001",
      "related_object_ids": ["vlm_obj_002"],
      "description": "The pedestrian may enter the roadway from the right side.",
      "confidence": 0.72
    }
  ]
}
